{"$schema":"https://json-schema.org/draft/2020-12/schema","$id":"https://r8-kumamoto-saigai.local/schemas/reconstruction/application-period.schema.json","type":"array","items":{"type":"object","additionalProperties":false,"required":["id","applicationId","periodPurpose","municipalityId","startsAt","deadlineAt","deadlineType","isExtended","previousDeadlineAt","status","sourceLinkIds","verificationStatus","notes"],"properties":{"id":{"type":"string","pattern":"^period_[a-z0-9_]+$"},"applicationId":{"type":"string"},"periodPurpose":{"enum":["application_window","repair_completion","program_effective_period","temporary_housing_use"]},"municipalityId":{"type":["string","null"]},"startsAt":{"$ref":"common.schema.json#/$defs/nullableDateOrDateTime"},"deadlineAt":{"$ref":"common.schema.json#/$defs/nullableDateOrDateTime"},"deadlineType":{"enum":["fixed","rolling","none","pending","unknown"]},"isExtended":{"type":"boolean"},"previousDeadlineAt":{"$ref":"common.schema.json#/$defs/nullableDateOrDateTime"},"status":{"enum":["pending_announcement","scheduled","open","closed","expired","unknown"]},"sourceLinkIds":{"$ref":"common.schema.json#/$defs/idArray"},"verificationStatus":{"$ref":"common.schema.json#/$defs/verificationStatus"},"notes":{"type":["string","null"]}}}}
